{
  "contract_version": "1.0.0",
  "analysis_id": "00000001-0000-4000-8000-000000000001",
  "sample": {
    "vault_id": "00000001-0000-4000-8000-000000000001",
    "sha256": "aaaaaaaaaaaaaaaaaaaaaaaaaaaaaaaaaaaaaaaaaaaaaaaaaaaaaaaaaaaaaaaa",
    "md5": "bbbbbbbbbbbbbbbbbbbbbbbbbbbbbbbb",
    "size_bytes": 18432,
    "file_type": "pe",
    "original_name": "hello_test.exe",
    "received_at": "2026-10-10T09:00:00Z",
    "submitter": "analyst1",
    "stored_defanged": true,
    "stored_encrypted": true,
    "clamav_result": "not_run"
  },
  "pipeline": {
    "status": "complete",
    "stages": {
      "ingest": "done",
      "static": "done",
      "dynamic": "done",
      "iocs": "done",
      "scoring": "done",
      "response": "done",
      "report": "done"
    },
    "retries": 0
  },
  "static": {
    "status": "done",
    "file_class": "pe",
    "entropy": 5.1,
    "packers": [],
    "pe": {
      "is_dll": false,
      "signed": true,
      "sections": [
        {
          "name": ".text",
          "entropy": 6.0
        },
        {
          "name": ".data",
          "entropy": 3.2
        }
      ],
      "imports": [
        "KERNEL32.dll!ExitProcess"
      ]
    },
    "strings": {
      "count": 212,
      "interesting": []
    },
    "yara_matches": []
  },
  "dynamic": {
    "status": "done",
    "sandbox": {
      "engine": "capev2",
      "guest_os": "win10-x64",
      "run_id": "run-0001",
      "duration_s": 60,
      "timeout_s": 120,
      "network_mode": "isolated",
      "reverted": true
    },
    "process_tree": [
      {
        "pid": 1200,
        "ppid": 900,
        "name": "hello_test.exe"
      }
    ],
    "file_events": [],
    "registry_events": [],
    "mutexes": [],
    "dropped_files": [],
    "api_summary": {
      "ExitProcess": 1
    }
  },
  "iocs": {
    "status": "done",
    "items": [],
    "attack_techniques": []
  },
  "detections": {
    "status": "done",
    "items": [],
    "intel_hits": [
      {
        "provider": "virustotal",
        "indicator": "aaaaaaaaaaaaaaaaaaaaaaaaaaaaaaaaaaaaaaaaaaaaaaaaaaaaaaaaaaaaaaaa",
        "result": "known_clean",
        "cached": false
      }
    ]
  },
  "score": {
    "value": 3,
    "method": "weighted_rules_v1",
    "components": [
      {
        "name": "static_findings",
        "weight": 0.4,
        "contribution": 1
      },
      {
        "name": "behaviors",
        "weight": 0.4,
        "contribution": 0
      },
      {
        "name": "intel",
        "weight": 0.2,
        "contribution": 2
      }
    ]
  },
  "verdict": {
    "label": "benign",
    "severity": "info",
    "confidence": 0.97,
    "behavior_tags": [],
    "explanation": [
      "No YARA matches",
      "No suspicious behavior in sandbox",
      "Known-clean in threat intel"
    ]
  },
  "response_actions": []
}